Report,Question,Answer
Cuddy2011_GWModelOfMimbresBasin.pdf,What are the water chemistry data sources?,"From the listed sources, water‐quality (chemistry) information primarily appears in the older State Engineer and consultant reports—especially in works by Theis (1939), White (1934), White and Guyton (1951), Spiegel (1956), and Trauger (1972)—as well as in later surveys such as the Water Resources Research Institute (2000) report on trans‐boundary aquifers. These publications are the main documented sources of water chemistry data in the references provided.

o3-mini Evaluation:
Correct?: No

Explanation: The report does not explicitly identify any sources dedicated to water chemistry. The cited references (e.g., Theis 1939, White 1934, White and Guyton 1951, Spiegel 1956, Trauger 1972, and the 2000 Water Resources Research Institute report) primarily address hydrology, groundwater supply, aquifer tests, and water resource assessments rather than water‐quality or chemistry data. There is no specific section or quote indicating that these publications provided water chemistry information.

Corrected Answer (if needed): The report does not clearly list any dedicated water chemistry data sources. The references provided focus on hydrology, groundwater flows, and aquifer testing, and while some older State Engineer and consultant reports (such as those by Theis, White, White and Guyton, Spiegel, Trauger) might include aspects of water properties, the report does not explicitly state that they are used as water chemistry data sources."
Finch2008_GeologicControlsOnGWFlowInMimbresBasin.pdf,"Were water levels collected for the study, compiled from other sources, or both?","From the sources cited, it appears the study incorporated existing water‐level data previously published (e.g., in USGS reports) but also gathered new observations to refine or supplement those data. In other words, both newly collected measurements and compiled historical information were used.

o3-mini Evaluation:
Correct?: No

Explanation: The report excerpt is a list of references and does not include any specific text stating that the study incorporated new field measurements in addition to previously published water‐level data. The original answer assumes that both types of data were used, but the cited document does not provide clear evidence for new measurements.

Corrected Answer (if needed): Based solely on the provided report, it appears that the water‐level data were compiled from prior publications and existing sources; there is no explicit indication in the excerpt that new water‐level measurements were collected."
Finch2008_GeologicControlsOnGWFlowInMimbresBasin.pdf,"If specific hydrogeologic properties were published, how were they determined? If no specific hydrogeologic properties were reported, answer ""N/A"".","N/A

o3-mini Evaluation:
Correct?: No

Explanation: The original answer “N/A” implies that no specific hydrogeologic properties were reported. However, the report does mention measurable attributes (e.g., basin‐fill thickness over 2500 ft along certain faults/uplifts and recharge percentages such as the 5% recharge in the Florida hydrogeologic region). These properties were determined through integrated approaches including geological mapping, field observations, and numerical groundwater flow modeling as referenced (e.g., Hawley et al., 2000; McCoy and Finch, 2006).

Corrected Answer (if needed): Specific hydrogeologic properties—such as basin‐fill thickness and recharge percentages—were determined by combining field observations and detailed geologic mapping with numerical groundwater flow models. For example, the report indicates that basin‐fill thickness (over 2500 ft in some areas) was established along faults and uplifts, and recharge to the Florida hydrogeologic region (accounting for 5% of total recharge) was derived from watershed analyses and modeling efforts (see Hawley et al., 2000; McCoy and Finch, 2006)."
Finch2008_GeologicControlsOnGWFlowInMimbresBasin.pdf,What are the future work recommendations for this study? Please be detailed.,"Based on the information provided, the report does not explicitly state future work recommendations. However, the following points can be inferred as beneficial areas for further study:

• Refine Aquifer Characterization: Collect additional data on bedrock aquifers, especially in areas where volcanic rocks and fractured granite are poorly understood (e.g., the northern part of the Florida hydrogeologic region).  
• Expand Water Quality Monitoring: Investigate variations in total dissolved solids (TDS) and other water-quality parameters, focusing on locations where bedrock permeability or flow paths are uncertain.  
• Improve Recharge and Discharge Estimates: Continue evaluating mountain-front and areal recharge processes—particularly in faulted areas and ephemeral stream zones—to refine model estimates and assess whether present recharge figures might change under varying climatic conditions.  
• Assess Structural Controls on Flow: Study the effects of buried bedrock highs, sills, and fault zones on groundwater movement and storage, especially in narrowed flow paths like those between the Florida Mountains and Tres Hermanas.  
• Update Groundwater Flow Modeling: Incorporate new monitoring data and refine the existing model to better represent hydraulic conductivities in both basin fill and bedrock, and to account for different pumping scenarios in areas of high irrigation demand.

o3-mini Evaluation:
Correct?: No

Explanation: The report does not explicitly state any future work recommendations. The original answer infers several areas for investigation (such as improved aquifer characterization, expanded water quality monitoring, etc.) that are not directly referenced in the report’s text. There are no supporting quotes or specific sections from the report that call for these follow‐up studies.

Corrected Answer (if needed): The report does not provide any explicit future work recommendations. It focuses on summarizing the hydrogeologic framework and the results from the groundwater-flow model without outlining areas for further research."
Heywood2002_EstimationAlluvialFillThicknessMimbresGWBasinNM.pdf,What is the title of the study?,"No explicit title is stated in the excerpt. From the context—analysis of gravity data, basin‐fill thickness, and geologic units in the Mimbres Basin—it appears to be a U.S. Geological Survey study focused on the geophysical and geologic characterization of the Mimbres Basin in southwestern New Mexico, but the exact title is not given in the provided text.

o3-mini Evaluation:
Correct?: No

Explanation: While the excerpt does not contain a separately printed title, the URL (filename) indicates the study’s title. The filename ""Heywood2002_EstimationAlluvialFillThicknessMimbresGWBasinNM.pdf"" suggests that the study is titled ""Estimation of Alluvial Fill Thickness in the Mimbres Basin, New Mexico."" The original answer overlooked this naming cue.

Corrected Answer (if needed): The study is titled “Estimation of Alluvial Fill Thickness in the Mimbres Basin, New Mexico” (as indicated by the filename ""Heywood2002_EstimationAlluvialFillThicknessMimbresGWBasinNM.pdf"")."
Heywood2002_EstimationAlluvialFillThicknessMimbresGWBasinNM.pdf,What are the water chemistry data sources?,"From the listed sources, the primary water‐chemistry discussions or data appear most clearly in reports focused on groundwater and aquifer conditions—particularly Hanson et al. (1994), Kennedy et al. (2000), White (1930), and possibly Wilkins (1998). These USGS and state reports, along with the “Trans‐international boundary aquifers” study (Kennedy et al.), are the most likely to provide or cite the underlying water‐quality (chemistry) data.

o3-mini Evaluation:
Correct?: No

Explanation: The answer is speculative. The report text does not explicitly identify any specific water chemistry data sources. The references mainly focus on geophysical mapping, groundwater flow, and aquifer studies, so assuming that water‐chemistry information comes primarily from Hanson et al. (1994), Kennedy et al. (2000), White (1930), and Wilkins (1998) is not directly supported by quotations or explicit content in the report.

Corrected Answer (if needed): The report does not clearly indicate dedicated water chemistry data sources. Most of the listed references pertain to geophysical methods, groundwater flow, structural mapping, or aquifer analyses. If any water‐chemistry information is included, it would likely be incidental to studies such as Hanson et al. (1994) “Hydro‐geologic framework and preliminary simulation of ground‐water flow in the Mimbres Basin” or Kennedy et al. (2000) “Trans‐international boundary aquifers…” and possibly those addressing groundwater supply like White (1930) and Wilkins (1998). However, since the report does not provide explicit details on water chemistry, no clear conclusions can be drawn."
Kennedy2000_HydrogeologicFrameworkOfBasinFillAquifersAndGWFlowSystemsSouthwestNM.pdf,What is the title of the study?,"The excerpt does not explicitly provide a formal study title. However, based on its acknowledgments and context, it appears that the work is part of the “Trans-International Boundary Aquifer Project.”

o3-mini Evaluation:
Correct?: No

Explanation: The provided answer incorrectly identifies the Trans‐International Boundary Aquifer Project as the study title. In the report, this project is only mentioned in the acknowledgments as its funding source. The report’s URL indicates a title that relates to “Hydrogeologic Framework Of Basin Fill Aquifers And GW Flow Systems Southwest NM,” which is not extracted from the acknowledgments section.

Corrected Answer (if needed): The study’s title is “Hydrogeologic Framework Of Basin Fill Aquifers And GW Flow Systems Southwest NM” (as indicated by the filename Kennedy2000_HydrogeologicFrameworkOfBasinFillAquifersAndGWFlowSystemsSouthwestNM.pdf)."
Kennedy2000_HydrogeologicFrameworkOfBasinFillAquifersAndGWFlowSystemsSouthwestNM.pdf,What are the future work recommendations for this study? Please be detailed.,"Based on the range of studies cited—many of which focus on mapping, stratigraphic characterization, fault identification, and aquifer modeling—the most reasonable future work recommendations include:

• Refine Basin Geometry and Stratigraphy: Build upon existing geologic mapping (e.g., Seager et al.) and geophysical surveys to better resolve the three-dimensional shape of the basins, fault structures, and the detailed distribution of aquifer-bearing sediments.  
• Improve Hydrogeologic Models: Update groundwater flow models (such as those by O’Brien & Stone, Peterson et al., and Wilkins) with new well data, modern geophysical insights, and revised fault interpretations. This may include integrating quasi-three-dimensional approaches into fully three-dimensional models.  
• Enhance Recharge and Discharge Estimates: Collect additional field data on infiltration rates—especially along ephemeral channels—and refine estimates of subsurface recharge to better constrain boundary conditions in the models.  
• Expand Monitoring Networks: Establish more comprehensive water-level and water-quality monitoring networks to track spatiotemporal trends in aquifer conditions, verify model predictions, and detect early signs of contamination or depletion.  
• Evaluate Climate and Paleohydrology Effects: Incorporate Quaternary climate variability (as noted by Morrison, Van Devender & Worthington, and others) to clarify how past pluvial conditions shaped the basins and how projected climate changes might affect long-term groundwater availability.  

These steps would help reduce uncertainties about basin structure, recharge processes, and overall aquifer sustainability, thereby improving water-resource management decisions in the region.

o3-mini Evaluation:
Correct?: No

Explanation: The provided report is essentially a list of references without any explicit section outlining future work recommendations. The original answer extrapolates recommendations based on the themes of the cited studies, but none of these recommendations are directly stated or clearly supported by the report’s content. There are no specific quotes or sections in the report that mention future work.

Corrected Answer (if needed): The report does not detail any explicit future work recommendations. It is primarily a compilation of citations related to Quaternary stratigraphy, hydrogeology, fault mapping, and groundwater modeling in southwestern New Mexico. Without additional context or direct statements on future work in the report text, any recommendations would be speculative rather than based on the provided material."
Rawling2021_EvaluationOfWaterLevelTrendsMimbresBasin.pdf,What is the title of the study?,"The excerpt does not explicitly state the study’s title. However, it appears to be a 2022 Hydrogeology Journal article (volume 30, pages 2479–2494) focusing on spatiotemporal regression kriging of water levels in the Mimbres Basin, southwestern New Mexico. The exact title is not given in the provided text.

o3-mini Evaluation:
Correct?: No

Explanation: The answer overlooks the information in the file name. The URL ""Rawling2021_EvaluationOfWaterLevelTrendsMimbresBasin.pdf"" strongly implies that the study is titled “Evaluation of Water Level Trends in the Mimbres Basin.” Although the body of the text does not explicitly restate the title, this can be inferred from the file name and supporting publication details.

Corrected Answer (if needed): The study is titled “Evaluation of Water Level Trends in the Mimbres Basin.” This is indicated by the file name “Rawling2021_EvaluationOfWaterLevelTrendsMimbresBasin.pdf” and the publication reference in Hydrogeology Journal (2022, volume 30, pages 2479–2494)."
